{
  "$schema": "https://json-schema.org/draft/2020-12/schema",
  "$id": "https://github.com/icanc0/kicad-library/schema/kag-part-manifest-v1.schema.json",
  "title": "KiCad Agent Guide part manifest v1",
  "description": "Strict sidecar metadata for one logical part identity and its repository assets. Only extensions may carry undeclared properties.",
  "type": "object",
  "additionalProperties": false,
  "required": [
    "$schema",
    "schema_version",
    "part_id",
    "record_state",
    "identity",
    "names",
    "classifications",
    "assets",
    "relationships",
    "provenance",
    "extensions"
  ],
  "properties": {
    "$schema": {
      "const": "../schema/kag-part-manifest-v1.schema.json"
    },
    "schema_version": {
      "const": "1.0.0"
    },
    "part_id": {
      "type": "string",
      "pattern": "^[a-z0-9]+(?:[.-][a-z0-9]+)*$"
    },
    "record_state": {
      "enum": [
        "symbol-only",
        "complete",
        "quarantined"
      ]
    },
    "identity": {
      "$ref": "#/$defs/identity"
    },
    "names": {
      "$ref": "#/$defs/names"
    },
    "classifications": {
      "$ref": "#/$defs/classifications"
    },
    "assets": {
      "type": "array",
      "minItems": 1,
      "items": {
        "$ref": "#/$defs/asset"
      }
    },
    "relationships": {
      "type": "array",
      "items": {
        "$ref": "#/$defs/relationship"
      }
    },
    "provenance": {
      "$ref": "#/$defs/provenance"
    },
    "quarantine": {
      "$ref": "#/$defs/quarantine"
    },
    "extensions": {
      "type": "object",
      "description": "Namespaced escape hatch for future or consumer-specific metadata.",
      "additionalProperties": true
    }
  },
  "allOf": [
    {
      "if": {
        "properties": {
          "record_state": {
            "const": "quarantined"
          }
        },
        "required": [
          "record_state"
        ]
      },
      "then": {
        "properties": {
          "quarantine": {
            "$ref": "#/$defs/quarantine"
          },
          "assets": {
            "items": {
              "properties": {
                "qualification": {
                  "const": "quarantined"
                }
              }
            }
          }
        },
        "required": [
          "quarantine"
        ]
      },
      "else": {
        "not": {
          "required": [
            "quarantine"
          ]
        }
      }
    },
    {
      "if": {
        "properties": {
          "record_state": {
            "const": "symbol-only"
          }
        },
        "required": [
          "record_state"
        ]
      },
      "then": {
        "properties": {
          "assets": {
            "contains": {
              "properties": {
                "kind": {
                  "const": "symbol"
                },
                "qualification": {
                  "const": "qualified"
                }
              },
              "required": [
                "kind",
                "qualification"
              ]
            }
          }
        },
        "not": {
          "properties": {
            "assets": {
              "contains": {
                "properties": {
                  "kind": {
                    "enum": [
                      "footprint",
                      "model"
                    ]
                  },
                  "qualification": {
                    "const": "qualified"
                  }
                },
                "required": [
                  "kind",
                  "qualification"
                ]
              }
            }
          }
        }
      }
    },
    {
      "if": {
        "properties": {
          "record_state": {
            "const": "complete"
          }
        },
        "required": [
          "record_state"
        ]
      },
      "then": {
        "properties": {
          "assets": {
            "allOf": [
              {
                "contains": {
                  "properties": {
                    "kind": {
                      "const": "symbol"
                    },
                    "qualification": {
                      "const": "qualified"
                    }
                  },
                  "required": [
                    "kind",
                    "qualification"
                  ]
                }
              },
              {
                "contains": {
                  "properties": {
                    "kind": {
                      "const": "footprint"
                    },
                    "qualification": {
                      "const": "qualified"
                    }
                  },
                  "required": [
                    "kind",
                    "qualification"
                  ]
                }
              }
            ]
          }
        }
      }
    }
  ],
  "$defs": {
    "nonEmptyString": {
      "type": "string",
      "minLength": 1
    },
    "sha256": {
      "description": "Lowercase SHA-256 digest of the asset's raw file bytes, with no normalization or reserialization.",
      "type": "string",
      "pattern": "^[0-9a-f]{64}$"
    },
    "gitSha": {
      "type": "string",
      "pattern": "^[0-9a-f]{40}$"
    },
    "repoPath": {
      "type": "string",
      "minLength": 1,
      "pattern": "^(?!\\.?$)(?!\\./)(?!/)(?![A-Za-z]:)(?![A-Za-z][A-Za-z0-9+.-]*:)(?!.*\\\\)(?!.*(?:^|/)\\.\\.(?:/|$)).+$"
    },
    "manufacturer": {
      "type": "object",
      "additionalProperties": false,
      "required": [
        "display",
        "normalized"
      ],
      "properties": {
        "display": {
          "$ref": "#/$defs/nonEmptyString"
        },
        "normalized": {
          "type": "string",
          "pattern": "^[a-z0-9]+(?:-[a-z0-9]+)*$"
        }
      }
    },
    "identifier": {
      "type": "object",
      "additionalProperties": false,
      "required": [
        "scheme",
        "value"
      ],
      "properties": {
        "scheme": {
          "type": "string",
          "pattern": "^[a-z0-9]+(?:-[a-z0-9]+)*$"
        },
        "value": {
          "$ref": "#/$defs/nonEmptyString"
        }
      }
    },
    "mpn": {
      "type": "object",
      "additionalProperties": false,
      "required": [
        "status",
        "raw",
        "canonical",
        "comparison_key",
        "normalization",
        "significant_characters"
      ],
      "properties": {
        "status": {
          "enum": [
            "exact",
            "unknown",
            "not-applicable"
          ]
        },
        "raw": {
          "type": [
            "string",
            "null"
          ]
        },
        "canonical": {
          "type": [
            "string",
            "null"
          ]
        },
        "comparison_key": {
          "type": [
            "string",
            "null"
          ]
        },
        "normalization": {
          "type": "array",
          "uniqueItems": true,
          "items": {
            "enum": [
              "trim",
              "uppercase",
              "remove-hyphen",
              "remove-space"
            ]
          }
        },
        "significant_characters": {
          "type": "array",
          "uniqueItems": true,
          "items": {
            "type": "string",
            "minLength": 1,
            "maxLength": 1
          }
        }
      },
      "allOf": [
        {
          "if": {
            "properties": {
              "status": {
                "const": "exact"
              }
            },
            "required": [
              "status"
            ]
          },
          "then": {
            "properties": {
              "raw": {
                "$ref": "#/$defs/nonEmptyString"
              },
              "canonical": {
                "$ref": "#/$defs/nonEmptyString"
              },
              "comparison_key": {
                "$ref": "#/$defs/nonEmptyString"
              }
            }
          }
        },
        {
          "if": {
            "properties": {
              "status": {
                "const": "not-applicable"
              }
            },
            "required": [
              "status"
            ]
          },
          "then": {
            "properties": {
              "raw": {
                "const": null
              },
              "canonical": {
                "const": null
              },
              "comparison_key": {
                "const": null
              },
              "normalization": {
                "type": "array",
                "maxItems": 0
              },
              "significant_characters": {
                "type": "array",
                "maxItems": 0
              }
            }
          }
        }
      ]
    },
    "identity": {
      "type": "object",
      "additionalProperties": false,
      "required": [
        "type",
        "manufacturer",
        "mpn",
        "identifiers",
        "description"
      ],
      "properties": {
        "type": {
          "enum": [
            "manufactured-part",
            "utility"
          ]
        },
        "manufacturer": {
          "oneOf": [
            {
              "$ref": "#/$defs/manufacturer"
            },
            {
              "type": "null"
            }
          ]
        },
        "mpn": {
          "$ref": "#/$defs/mpn"
        },
        "identifiers": {
          "type": "array",
          "items": {
            "$ref": "#/$defs/identifier"
          }
        },
        "description": {
          "$ref": "#/$defs/nonEmptyString"
        }
      }
    },
    "internalSymbol": {
      "type": "object",
      "additionalProperties": false,
      "required": [
        "asset_path",
        "name"
      ],
      "properties": {
        "asset_path": {
          "$ref": "#/$defs/repoPath"
        },
        "name": {
          "$ref": "#/$defs/nonEmptyString"
        }
      }
    },
    "names": {
      "type": "object",
      "additionalProperties": false,
      "required": [
        "canonical",
        "aliases",
        "internal_symbols"
      ],
      "properties": {
        "canonical": {
          "$ref": "#/$defs/nonEmptyString"
        },
        "aliases": {
          "type": "array",
          "uniqueItems": true,
          "items": {
            "$ref": "#/$defs/nonEmptyString"
          }
        },
        "internal_symbols": {
          "type": "array",
          "minItems": 1,
          "items": {
            "$ref": "#/$defs/internalSymbol"
          }
        }
      }
    },
    "package": {
      "type": "object",
      "additionalProperties": false,
      "required": [
        "display",
        "terminal_count",
        "evidence"
      ],
      "properties": {
        "display": {
          "$ref": "#/$defs/nonEmptyString"
        },
        "terminal_count": {
          "type": "integer",
          "minimum": 1
        },
        "evidence": {
          "$ref": "#/$defs/nonEmptyString"
        }
      }
    },
    "family": {
      "type": "object",
      "additionalProperties": false,
      "required": [
        "kind",
        "id",
        "role"
      ],
      "properties": {
        "kind": {
          "enum": [
            "silicon",
            "package",
            "product"
          ]
        },
        "id": {
          "type": "string",
          "pattern": "^[a-z0-9]+(?:[.-][a-z0-9]+)*$"
        },
        "role": {
          "const": "member"
        }
      }
    },
    "classifications": {
      "type": "object",
      "additionalProperties": false,
      "required": [
        "package",
        "families"
      ],
      "properties": {
        "package": {
          "oneOf": [
            {
              "$ref": "#/$defs/package"
            },
            {
              "type": "null"
            }
          ]
        },
        "families": {
          "type": "array",
          "items": {
            "$ref": "#/$defs/family"
          }
        }
      }
    },
    "asset": {
      "type": "object",
      "additionalProperties": false,
      "required": [
        "path",
        "kind",
        "qualification",
        "sha256"
      ],
      "properties": {
        "path": {
          "$ref": "#/$defs/repoPath"
        },
        "kind": {
          "enum": [
            "symbol",
            "footprint",
            "model"
          ]
        },
        "qualification": {
          "enum": [
            "qualified",
            "unqualified-candidate",
            "quarantined"
          ]
        },
        "sha256": {
          "$ref": "#/$defs/sha256"
        },
        "internal_name": {
          "$ref": "#/$defs/nonEmptyString"
        }
      }
    },
    "assetTarget": {
      "type": "object",
      "additionalProperties": false,
      "required": [
        "asset_path"
      ],
      "properties": {
        "asset_path": {
          "$ref": "#/$defs/repoPath"
        }
      }
    },
    "partTarget": {
      "type": "object",
      "additionalProperties": false,
      "required": [
        "part_id"
      ],
      "properties": {
        "part_id": {
          "type": "string",
          "pattern": "^[a-z0-9]+(?:[.-][a-z0-9]+)*$"
        }
      }
    },
    "referenceTarget": {
      "type": "object",
      "additionalProperties": false,
      "required": [
        "declared_reference"
      ],
      "properties": {
        "declared_reference": {
          "$ref": "#/$defs/nonEmptyString"
        }
      }
    },
    "relationship": {
      "type": "object",
      "additionalProperties": false,
      "required": [
        "kind",
        "source_asset",
        "target",
        "disposition",
        "evidence"
      ],
      "properties": {
        "kind": {
          "enum": [
            "declares-footprint",
            "declares-model",
            "name-match",
            "same-silicon-family",
            "same-mpn",
            "replacement"
          ]
        },
        "source_asset": {
          "$ref": "#/$defs/repoPath"
        },
        "target": {
          "oneOf": [
            {
              "$ref": "#/$defs/assetTarget"
            },
            {
              "$ref": "#/$defs/partTarget"
            },
            {
              "$ref": "#/$defs/referenceTarget"
            }
          ]
        },
        "disposition": {
          "enum": [
            "unqualified-candidate",
            "missing",
            "informational",
            "replacement",
            "quarantined"
          ]
        },
        "evidence": {
          "$ref": "#/$defs/nonEmptyString"
        }
      }
    },
    "provenanceEntry": {
      "type": "object",
      "additionalProperties": false,
      "required": [
        "kind",
        "path",
        "locator",
        "evidence"
      ],
      "properties": {
        "kind": {
          "enum": [
            "manifest",
            "git-introduction",
            "asset-property",
            "datasheet"
          ]
        },
        "path": {
          "$ref": "#/$defs/repoPath"
        },
        "locator": {
          "$ref": "#/$defs/nonEmptyString"
        },
        "evidence": {
          "$ref": "#/$defs/nonEmptyString"
        },
        "commit": {
          "$ref": "#/$defs/gitSha"
        },
        "date": {
          "type": "string",
          "pattern": "^\\d{4}-\\d{2}-\\d{2}T\\d{2}:\\d{2}:\\d{2}(?:Z|[+-]\\d{2}:\\d{2})$"
        }
      }
    },
    "provenance": {
      "type": "object",
      "additionalProperties": false,
      "required": [
        "repository_commit",
        "source_board",
        "entries"
      ],
      "properties": {
        "repository_commit": {
          "$ref": "#/$defs/gitSha"
        },
        "source_board": {
          "type": [
            "string",
            "null"
          ]
        },
        "entries": {
          "type": "array",
          "minItems": 1,
          "items": {
            "$ref": "#/$defs/provenanceEntry"
          }
        }
      }
    },
    "quarantine": {
      "type": "object",
      "additionalProperties": false,
      "required": [
        "reason_codes",
        "reason",
        "replacement_part_id"
      ],
      "properties": {
        "reason_codes": {
          "type": "array",
          "minItems": 1,
          "uniqueItems": true,
          "items": {
            "type": "string",
            "pattern": "^[a-z0-9]+(?:-[a-z0-9]+)*$"
          }
        },
        "reason": {
          "$ref": "#/$defs/nonEmptyString"
        },
        "replacement_part_id": {
          "type": "string",
          "pattern": "^[a-z0-9]+(?:[.-][a-z0-9]+)*$"
        }
      }
    }
  }
}
