{
  "$schema": "../schema/kag-part-manifest-v1.schema.json",
  "schema_version": "1.0.0",
  "part_id": "fullway.fsw3410",
  "record_state": "symbol-only",
  "identity": {
    "type": "manufactured-part",
    "manufacturer": {
      "display": "Full-Way",
      "normalized": "full-way"
    },
    "mpn": {
      "status": "exact",
      "raw": "FSW3410YQFN18G/TR",
      "canonical": "FSW3410YQFN18G/TR",
      "comparison_key": "FSW3410YQFN18G",
      "normalization": [
        "trim",
        "uppercase"
      ],
      "significant_characters": []
    },
    "identifiers": [
      {
        "scheme": "lcsc",
        "value": "C41370613"
      }
    ],
    "description": "portable fp re-land: authored footprint promoted alongside; baked Footprint rewritten to central-agent:FSW3410_FP (same class as the AP64500 re-land)."
  },
  "names": {
    "canonical": "FSW3410YQFN18G/TR",
    "aliases": [
      "FSW3410"
    ],
    "internal_symbols": [
      {
        "asset_path": "symbols/FSW3410.kicad_sym",
        "name": "FSW3410"
      }
    ]
  },
  "classifications": {
    "package": null,
    "families": []
  },
  "assets": [
    {
      "path": "symbols/FSW3410.kicad_sym",
      "kind": "symbol",
      "qualification": "qualified",
      "sha256": "2befce1eb64a5b14f0f4764395dac6420a64554d416ca88d36685719050acf08",
      "internal_name": "FSW3410"
    },
    {
      "path": "footprints/central-agent.pretty/FSW3410_FP.kicad_mod",
      "kind": "footprint",
      "qualification": "unqualified-candidate",
      "sha256": "1e0fb52d1b1670642b9d37870cbe14ce0857632effbfdba4f4ab1a4bb7296437",
      "internal_name": "FSW3410_FP"
    }
  ],
  "relationships": [
    {
      "kind": "declares-footprint",
      "source_asset": "symbols/FSW3410.kicad_sym",
      "target": {
        "asset_path": "footprints/central-agent.pretty/FSW3410_FP.kicad_mod"
      },
      "disposition": "unqualified-candidate",
      "evidence": "Promotion supplied this footprint as a candidate; it is not qualified by a symbol-only draft."
    }
  ],
  "provenance": {
    "repository_commit": "9efbca1b142bf81d507c7de9b6ef6bab4951e299",
    "source_board": "skibidi-hub",
    "entries": [
      {
        "kind": "manifest",
        "path": "MANIFEST.md",
        "locator": "promotion entry for symbols/FSW3410.kicad_sym",
        "evidence": "First-import fit pass: COUNCIL10 fit pass as recorded at the symbol's first promotion (same ink); footprint is the skibidi-hub authored land shipped on that board."
      }
    ]
  },
  "extensions": {
    "promotion": {
      "fit_note": "COUNCIL10 fit pass as recorded at the symbol's first promotion (same ink); footprint is the skibidi-hub authored land shipped on that board.",
      "note": "portable fp re-land: authored footprint promoted alongside; baked Footprint rewritten to central-agent:FSW3410_FP (same class as the AP64500 re-land).",
      "pin_gate": {
        "symbol": "FSW3410",
        "lcsc": "C41370613",
        "facts_checked": true,
        "board_context": null,
        "state": "waived",
        "gaps": [
          {
            "code": "PIN-FACTS",
            "detail": "ds_pin_ready(C41370613) is not ready over 19 pin(s): 0 fact(s), missing pins ['1', '10', '11', '12', '13', '14', '15', '16'], single-source [], disputed [] — two independent verified sources per pin (docs/10) before the SHARED library carries this map"
          }
        ],
        "allow_pin_gaps": "pin map usage-proven on skibidi-hub (ERC 0/0 + golden netlist + FLOWTHRU gates); COUNCIL10 page-precise datasheet indexes. Two-source per-pin fact rows queued as pmic-test-arena librarian intake (L24)."
      }
    }
  }
}
