{
  "$schema": "../schema/kag-part-manifest-v1.schema.json",
  "schema_version": "1.0.0",
  "part_id": "wch.ch634x",
  "record_state": "symbol-only",
  "identity": {
    "type": "manufactured-part",
    "manufacturer": {
      "display": "WCH (Nanjing Qinheng)",
      "normalized": "wch-nanjing-qinheng"
    },
    "mpn": {
      "status": "exact",
      "raw": "CH634X",
      "canonical": "CH634X",
      "comparison_key": "CH634X",
      "normalization": [
        "trim",
        "uppercase"
      ],
      "significant_characters": []
    },
    "identifiers": [
      {
        "scheme": "lcsc",
        "value": "C48985831"
      }
    ],
    "description": "COUNCIL10 flow-first rework (wf_0a811788-4e7, 2026-07-21/22): destination tiles (P1 Type-C 12-pin with orientation-mux fork, 4-wire PD LINK, 16 dead SS lanes in one block), internal power tree (VDD5 tee -> LDO 3V3 -> VDD33; -> DCDC -> VSW), Pierce oscillator at XI/XO, compound Table 4-4 names. Replaces the pre-council vintage (attic/CH634X_*.kicad_sym)."
  },
  "names": {
    "canonical": "CH634X",
    "aliases": [],
    "internal_symbols": [
      {
        "asset_path": "symbols/CH634X.kicad_sym",
        "name": "CH634X"
      }
    ]
  },
  "classifications": {
    "package": null,
    "families": []
  },
  "assets": [
    {
      "path": "symbols/CH634X.kicad_sym",
      "kind": "symbol",
      "qualification": "qualified",
      "sha256": "ac2d5a38f4d305e277f3107b094356651814437ce6dc8120c08079a1cf9e1f73",
      "internal_name": "CH634X"
    }
  ],
  "relationships": [],
  "provenance": {
    "repository_commit": "8fba08577423db7c49e8add8ece2a47d00daec14",
    "source_board": "skibidi-hub",
    "entries": [
      {
        "kind": "manifest",
        "path": "MANIFEST.md",
        "locator": "promotion entry for symbols/CH634X.kicad_sym",
        "evidence": "First-import fit pass: COUNCIL10 fit pass + 5-grader re-grade on skibidi-hub sheets (2026-07-22): hub-u1 graded A; AC title de-wrapped, fork tip pulled in 0.2mm; OVCUR input-tripwire reverted after ERC (internal 70k pull-up invisible to ERC); final build PASS ERC 0/0, legibility 0, FLOWTHRU 28/28. Owner 2026-08-21: extracted single-symbol, kicad-cli SVG re-rendered + LOOKed, L25 audit clean."
      }
    ]
  },
  "extensions": {
    "promotion": {
      "fit_note": "COUNCIL10 fit pass + 5-grader re-grade on skibidi-hub sheets (2026-07-22): hub-u1 graded A; AC title de-wrapped, fork tip pulled in 0.2mm; OVCUR input-tripwire reverted after ERC (internal 70k pull-up invisible to ERC); final build PASS ERC 0/0, legibility 0, FLOWTHRU 28/28. Owner 2026-08-21: extracted single-symbol, kicad-cli SVG re-rendered + LOOKed, L25 audit clean.",
      "note": "COUNCIL10 flow-first rework (wf_0a811788-4e7, 2026-07-21/22): destination tiles (P1 Type-C 12-pin with orientation-mux fork, 4-wire PD LINK, 16 dead SS lanes in one block), internal power tree (VDD5 tee -> LDO 3V3 -> VDD33; -> DCDC -> VSW), Pierce oscillator at XI/XO, compound Table 4-4 names. Replaces the pre-council vintage (attic/CH634X_*.kicad_sym).",
      "pin_gate": {
        "symbol": "CH634X",
        "lcsc": "C48985831",
        "facts_checked": true,
        "board_context": null,
        "state": "waived",
        "gaps": [
          {
            "code": "PIN-FACTS",
            "detail": "ds_pin_ready(C48985831) is not ready over 69 pin(s): 0 fact(s), missing pins ['1', '10', '11', '12', '13', '14', '15', '16'], single-source [], disputed [] — two independent verified sources per pin (docs/10) before the SHARED library carries this map"
          }
        ],
        "allow_pin_gaps": "pin map usage-proven on skibidi-hub (ERC 0/0 + golden netlist + FLOWTHRU gates); COUNCIL10 mined 5 comparable datasheets + own DS, page-precise indexes in skibidi-hub datasheets/comparables/CH634X-INDEX.md. Two-source per-pin fact rows queued as pmic-test-arena librarian intake (L24)."
      }
    }
  }
}
