{
  "$schema": "../schema/kag-part-manifest-v1.schema.json",
  "schema_version": "1.0.0",
  "part_id": "wch.ch217k",
  "record_state": "symbol-only",
  "identity": {
    "type": "manufactured-part",
    "manufacturer": {
      "display": "WCH (Nanjing Qinheng)",
      "normalized": "wch-nanjing-qinheng"
    },
    "mpn": {
      "status": "exact",
      "raw": "CH217K",
      "canonical": "CH217K",
      "comparison_key": "CH217K",
      "normalization": [
        "trim",
        "uppercase"
      ],
      "significant_characters": []
    },
    "identifiers": [
      {
        "scheme": "lcsc",
        "value": "C7462749"
      }
    ],
    "description": "COUNCIL10 flow-first rework (wf_0a811788-4e7, 2026-07-21/22): series SPST drawn ON the VIN->VOUT row, VOUT power-flow arrowhead, 0=ON enable truth, R>=22k floor + Iset=60k/Rset. Replaces the pre-council vintage (attic/CH217K_*.kicad_sym)."
  },
  "names": {
    "canonical": "CH217K",
    "aliases": [],
    "internal_symbols": [
      {
        "asset_path": "symbols/CH217K.kicad_sym",
        "name": "CH217K"
      }
    ]
  },
  "classifications": {
    "package": null,
    "families": []
  },
  "assets": [
    {
      "path": "symbols/CH217K.kicad_sym",
      "kind": "symbol",
      "qualification": "qualified",
      "sha256": "93f7b4ff55314539aa47bd6cca0888020d2e4ebda515a14076dd2220344e8d59",
      "internal_name": "CH217K"
    }
  ],
  "relationships": [],
  "provenance": {
    "repository_commit": "8fba08577423db7c49e8add8ece2a47d00daec14",
    "source_board": "skibidi-hub",
    "entries": [
      {
        "kind": "manifest",
        "path": "MANIFEST.md",
        "locator": "promotion entry for symbols/CH217K.kicad_sym",
        "evidence": "First-import fit pass: COUNCIL10 fit pass + 5-grader re-grade on skibidi-hub sheets (2026-07-22): sensors region B->fixed: TVS tap re-seated jx-34.29, both tail grazes clear; pin geometry byte-identical to pre-council; final build PASS ERC 0/0, legibility 0, FLOWTHRU 28/28. Owner 2026-08-21: extracted single-symbol, kicad-cli SVG re-rendered + LOOKed, L25 audit clean."
      }
    ]
  },
  "extensions": {
    "promotion": {
      "fit_note": "COUNCIL10 fit pass + 5-grader re-grade on skibidi-hub sheets (2026-07-22): sensors region B->fixed: TVS tap re-seated jx-34.29, both tail grazes clear; pin geometry byte-identical to pre-council; final build PASS ERC 0/0, legibility 0, FLOWTHRU 28/28. Owner 2026-08-21: extracted single-symbol, kicad-cli SVG re-rendered + LOOKed, L25 audit clean.",
      "note": "COUNCIL10 flow-first rework (wf_0a811788-4e7, 2026-07-21/22): series SPST drawn ON the VIN->VOUT row, VOUT power-flow arrowhead, 0=ON enable truth, R>=22k floor + Iset=60k/Rset. Replaces the pre-council vintage (attic/CH217K_*.kicad_sym).",
      "pin_gate": {
        "symbol": "CH217K",
        "lcsc": "C7462749",
        "facts_checked": true,
        "board_context": null,
        "state": "waived",
        "gaps": [
          {
            "code": "PIN-FACTS",
            "detail": "ds_pin_ready(C7462749) is not ready over 6 pin(s): 0 fact(s), missing pins ['1', '2', '3', '4', '5', '6'], single-source [], disputed [] — two independent verified sources per pin (docs/10) before the SHARED library carries this map"
          }
        ],
        "allow_pin_gaps": "pin map usage-proven on skibidi-hub (ERC 0/0 + golden netlist + FLOWTHRU gates); COUNCIL10 mined 5 comparable datasheets + own DS, page-precise indexes in skibidi-hub datasheets/comparables/CH217K-INDEX.md. Two-source per-pin fact rows queued as pmic-test-arena librarian intake (L24)."
      }
    }
  }
}
